{
  "problem_id": "problem-20250310-001",
  "title": "AI Sales Assistant for mid-market B2B companies",
  "problem_statement": "中端市场 B2B 公司（200-1000 名员工）缺乏可负担的 AI 销售工具。现有的企业级解决方案价格过高（$5,000+/月），而针对特定行业的 AI 销售工具几乎不存在。销售团队需要在不增加企业级工具复杂度和成本的情况下提升生产力。",
  "target_users": [
    "中端市场 B2B SaaS 公司（200-1000 名员工）的销售副总裁（VP of Sales）",
    "中端市场 B2B 公司（200-1000 名员工）的销售经理（Sales Manager）"
  ],
  "scenarios": [
    "场景 1：季度规划周期中，销售领导者评估工具以提升团队生产力，寻找比企业级工具更容易部署且更便宜的解决方案",
    "场景 2：销售团队希望在 2 周内快速部署 AI 销售助手，无需复杂的实施流程",
    "场景 3：销售负责人需要在 $500-2000/月的预算范围内选择可负担的工具",
    "场景 4：针对医疗、教育、法律三个垂直行业的销售团队需要行业特定的 AI 销售功能"
  ],
  "non_goals": [
    "不面向大型企业（Fortune 500 或 1000+ 员工）",
    "不提供企业级复杂度的解决方案（如大型 CRM 集成、复杂工作流配置）",
    "不覆盖小型企业（SMB，<200 名员工）",
    "不针对非垂直行业（如零售、制造业）的销售场景",
    "不提供 $5000+/月 的企业级定价方案",
    "不包含定制化本地部署选项（仅支持云端 SaaS）"
  ],
  "constraints": [
    "目标公司规模：200-1000 名员工（中端市场细分）",
    "必须避免企业级复杂度和定价",
    "初始垂直领域：医疗、教育、法律",
    "部署周期：必须在 2 周内可部署",
    "定价必须在中端市场预算范围内（预计 $500-2000/月）"
  ],
  "source_refs": [
    "src-20250310-001",
    "freeze-20250123-001",
    "layer3_freeze",
    "market_signal_analysis"
  ]
}
